{
  "meta": {
    "project_id": "northlight_01",
    "client_id": "meltemi_beverages",
    "project_type": "advertising_creative",
    "classification_confidence": "high",
    "sensitivity_tier": "S1",
    "sources": [
      {
        "source_id": "background_brand_guidelines",
        "source_type": "background",
        "source_date": "2026-03-02"
      },
      {
        "source_id": "emails_thread",
        "source_type": "email_thread",
        "source_date": "2026-07-15"
      },
      {
        "source_id": "rfp_meltemi",
        "source_type": "rfp",
        "source_date": "2026-06-28"
      },
      {
        "source_id": "transcript_kickoff",
        "source_type": "transcript",
        "source_date": "2026-07-10"
      }
    ],
    "created_ts": "2026-07-24T12:59:28",
    "pipeline_version": "brief-builder-stage1"
  },
  "objectives": [
    {
      "content": "Meltemi wants to catch the end of the soft-drinks season with this launch (timing pressure driving the schedule).",
      "original_lang": "el",
      "evidence": [
        {
          "source_id": "emails_thread",
          "location": "**Message 2** · From: Dimitris (Meltemi) · To: Eleni (Northlight) · Date: 2026-07-14 18:22",
          "anchor": "θέλουν να προλάβουμε το τέλος της σεζόν αναψυκτικών",
          "speaker_or_author": "Dimitris (Meltemi)"
        }
      ],
      "confidence": "high",
      "qualifier": "stated"
    },
    {
      "content": "Successful launch of the new product line in the Greek market.",
      "original_lang": "el",
      "evidence": [
        {
          "source_id": "rfp_meltemi",
          "location": "## 2. Στόχος",
          "anchor": "Επιτυχημένο launch της νέας σειράς στην ελληνική αγορά",
          "speaker_or_author": "Meltemi Beverages"
        }
      ],
      "confidence": "high",
      "qualifier": "stated"
    },
    {
      "content": "Building brand awareness is central: Meltemi Fizz enters a new category (sparkling tea) for the company, and they want to enter it strongly.",
      "original_lang": "mixed",
      "evidence": [
        {
          "source_id": "transcript_kickoff",
          "location": "[00:02:05]",
          "anchor": "Το βασικό για μας είναι το μπραντ αγουέρνες",
          "speaker_or_author": "DIMITRIS"
        }
      ],
      "confidence": "high",
      "qualifier": "stated"
    }
  ],
  "audiences": [],
  "key_messages": [
    {
      "content": "Tone of voice: confident, modern Greek with natural use of English category terms; humor is allowed but sarcasm about competitors is not.",
      "original_lang": "en",
      "evidence": [
        {
          "source_id": "background_brand_guidelines",
          "location": "## Tone (guidance)",
          "anchor": "Confident, modern Greek with natural use of English category terms. Humor allowed;",
          "speaker_or_author": "Meltemi Beverages (Brand Guidelines)"
        }
      ],
      "confidence": "high",
      "qualifier": "stated"
    },
    {
      "content": "Core message angle: refreshment without the sugar guilt — zero sugar, natural ingredients.",
      "original_lang": "mixed",
      "evidence": [
        {
          "source_id": "transcript_kickoff",
          "location": "[00:06:02]",
          "anchor": "refreshment without the sugar guilt — zero sugar, φυσικά υλικά",
          "speaker_or_author": "DIMITRIS"
        }
      ],
      "confidence": "high",
      "qualifier": "stated"
    },
    {
      "content": "Positioning: a Greek brand that owns the modern category (sparkling tea).",
      "original_lang": "mixed",
      "evidence": [
        {
          "source_id": "transcript_kickoff",
          "location": "[00:06:02]",
          "anchor": "ελληνικό brand που κάνει τη μοντέρνα κατηγορία δικιά του",
          "speaker_or_author": "DIMITRIS"
        }
      ],
      "confidence": "high",
      "qualifier": "stated"
    },
    {
      "content": "Visual direction: the key visual should evoke summer, but premium summer — not a generic beach-party feel.",
      "original_lang": "mixed",
      "evidence": [
        {
          "source_id": "transcript_kickoff",
          "location": "[00:06:02]",
          "anchor": "Το κι βίζουαλ πρέπει να φωνάζει καλοκαίρι, αλλά premium καλοκαίρι",
          "speaker_or_author": "DIMITRIS"
        }
      ],
      "confidence": "high",
      "qualifier": "stated"
    }
  ],
  "deliverables": [
    {
      "content": "Final approval of the brief is a required step before proceeding (approval authority still unconfirmed — see open questions).",
      "original_lang": "en",
      "evidence": [
        {
          "source_id": "emails_thread",
          "location": "**Message 1** · From: Eleni (Northlight) · To: Dimitris (Meltemi) · Date: 2026-07-11 09:40",
          "anchor": "τελικό approval του brief",
          "speaker_or_author": "Eleni (Northlight)"
        }
      ],
      "confidence": "medium",
      "qualifier": "implied"
    },
    {
      "content": "Northlight will send a revised plan reflecting the new launch date.",
      "original_lang": "el",
      "evidence": [
        {
          "source_id": "emails_thread",
          "location": "**Message 3** · From: Eleni (Northlight) · To: Dimitris (Meltemi) · Date: 2026-07-15 10:05",
          "anchor": "θα σας στείλουμε αναθεωρημένο πλάνο",
          "speaker_or_author": "Eleni (Northlight)"
        }
      ],
      "confidence": "high",
      "qualifier": "stated"
    },
    {
      "content": "Creative material for the launch: video and key visuals.",
      "original_lang": "mixed",
      "evidence": [
        {
          "source_id": "rfp_meltemi",
          "location": "## 4. Απαιτήσεις καμπάνιας",
          "anchor": "Δημιουργικό υλικό για το launch (βίντεο, key visuals)",
          "speaker_or_author": "Meltemi Beverages"
        }
      ],
      "confidence": "medium",
      "qualifier": "stated"
    },
    {
      "content": "Presence across social media and digital channels.",
      "original_lang": "mixed",
      "evidence": [
        {
          "source_id": "rfp_meltemi",
          "location": "## 4. Απαιτήσεις καμπάνιας",
          "anchor": "Παρουσία σε social media και ψηφιακά κανάλια",
          "speaker_or_author": "Meltemi Beverages"
        }
      ],
      "confidence": "high",
      "qualifier": "stated"
    },
    {
      "content": "Some videos and social content are planned, mainly; specific formats have not yet been decided.",
      "original_lang": "mixed",
      "evidence": [
        {
          "source_id": "transcript_kickoff",
          "location": "[00:10:22]",
          "anchor": "Some videos and social stuff, κυρίως. Δεν έχω καταλήξει σε formats",
          "speaker_or_author": "DIMITRIS"
        }
      ],
      "confidence": "medium",
      "qualifier": "stated"
    },
    {
      "content": "A possible TikTok dance activation was floated, but only as a speculative idea ('just thinking out loud, don't hold me to it').",
      "original_lang": "mixed",
      "evidence": [
        {
          "source_id": "transcript_kickoff",
          "location": "[00:11:47]",
          "anchor": "Just thinking out loud — maybe a TikTok dance thing? Don't hold me to it",
          "speaker_or_author": "DIMITRIS"
        }
      ],
      "confidence": "low",
      "qualifier": "conditional"
    }
  ],
  "timeline": [
    {
      "content": "Dimitris acknowledged that the timeline is tightening as a result of the date change.",
      "original_lang": "el",
      "evidence": [
        {
          "source_id": "emails_thread",
          "location": "**Message 2** · From: Dimitris (Meltemi) · To: Eleni (Northlight) · Date: 2026-07-14 18:22",
          "anchor": "Ξέρω ότι στενεύει το χρονοδιάγραμμα",
          "speaker_or_author": "Dimitris (Meltemi)"
        }
      ],
      "confidence": "high",
      "qualifier": "stated"
    },
    {
      "content": "Eleni noted that the 15 September date changes the production planning considerably.",
      "original_lang": "el",
      "evidence": [
        {
          "source_id": "emails_thread",
          "location": "**Message 3** · From: Eleni (Northlight) · To: Dimitris (Meltemi) · Date: 2026-07-15 10:05",
          "anchor": "το 15/9 αλλάζει αρκετά τον προγραμματισμό",
          "speaker_or_author": "Eleni (Northlight)"
        }
      ],
      "confidence": "high",
      "qualifier": "stated"
    }
  ],
  "budget": [],
  "mandatories": [
    {
      "content": "The product name Meltemi Fizz is always written in Latin script, in full — never transliterated, never abbreviated to \"Fizz\".",
      "original_lang": "en",
      "evidence": [
        {
          "source_id": "background_brand_guidelines",
          "location": "## Brand name usage",
          "anchor": "The product name **Meltemi Fizz** is always written in Latin script, in full.",
          "speaker_or_author": "Meltemi Beverages (Brand Guidelines)"
        }
      ],
      "confidence": "high",
      "qualifier": "stated"
    },
    {
      "content": "Logo clear space: minimum 1× the height of the wordmark on all sides.",
      "original_lang": "en",
      "evidence": [
        {
          "source_id": "background_brand_guidelines",
          "location": "## Brand name usage",
          "anchor": "Logo clear space: minimum 1× the height of the wordmark on all sides.",
          "speaker_or_author": "Meltemi Beverages (Brand Guidelines)"
        }
      ],
      "confidence": "high",
      "qualifier": "stated"
    },
    {
      "content": "Primary palette: Aegean Blue #1B4F8A, Citrus Yellow #F5C518. Backgrounds must not use gradients over photography.",
      "original_lang": "en",
      "evidence": [
        {
          "source_id": "background_brand_guidelines",
          "location": "## Color & visual",
          "anchor": "Primary palette: Aegean Blue #1B4F8A, Citrus Yellow #F5C518.",
          "speaker_or_author": "Meltemi Beverages (Brand Guidelines)"
        }
      ],